{
  "capabilities": [],
  "config_source": "db",
  "description": "#53: writes each section's summary with llm.complete on the OpenAI-compatible lobes gateway (model cortex-spark2; never the gateway's default model). No bridge, no tools, no repo. Shares the qwen-spark2 pool with the PR fixer, so a summary waits behind a running fix. base_url is spark's loopback: the action runs where the actor lives (machine spark); on another machine set the gateway's LAN address.",
  "enabled": true,
  "harness": null,
  "id": "newspaper-llm",
  "kind": "agent",
  "machine": "spark",
  "model": null,
  "name": "Daily newspaper: summaries (cortex)",
  "params": {
    "api_key": "grant:LOBES_GATEWAY_API_KEY",
    "base_url": "http://127.0.0.1:8001",
    "concurrency_pool": "qwen-spark2",
    "max_concurrency": 1,
    "model": "cortex-spark2"
  },
  "repo": null,
  "schema_version": "1.0"
}
