{
  "capabilities": [],
  "config_source": "db",
  "description": "#53: uploads the issue's EPUB to the xteink library and queues it for the reader. base_url is spark's loopback (xteink runs on spark): the action runs where the actor lives (machine spark); on another machine set xteink's LAN address. The device id is not shipped: it is the newspaper_device variable (GET /api/devices). The xtk_ key is the operator's, stored in grant as XTEINK_PUSH_API_KEY.",
  "enabled": true,
  "harness": null,
  "id": "newspaper-library",
  "kind": "service",
  "machine": "spark",
  "model": null,
  "name": "Daily newspaper: Xteink library",
  "params": {
    "api_key": "grant:XTEINK_PUSH_API_KEY",
    "base_url": "http://127.0.0.1:8780"
  },
  "repo": null,
  "schema_version": "1.0"
}
